
<?xml version="1.0" encoding="UTF-8"?>



<note test="111"
        xmlns="http://www.w3schools.com"
        xmlns:xsi="http://www.w3.org/2001/XMLSchema-instance"
        xsi:schemaLocation="http://www.w3schools.com note.xsd" >

    <to>Tove</to>
    <from>Jani</from>
    <heading>Reminder</heading>
    <body>Don't forget me this weekend!</body>

    <nba goat="222">
        <age>222</age>
        <dateborn>1970-03-27</dateborn>
    </nba>


</note>
